{
  "protocol_version": "0.1",
  "id": "pln_demo0000000000000001",
  "task_id": "tsk_demo0000000000000001",
  "task_revision": 1,
  "action_id": "issues.update_owner",
  "adapter": {
    "id": "http.issue_tracker",
    "version": "0.1.0+cfg.3a1f9c2b7d40"
  },
  "principal": "agent@example-project.iam.gserviceaccount.com",
  "grant_id": "grt_demo0000000000000001",
  "canonical_arguments": {
    "issue_id": "1001",
    "owner": "bob"
  },
  "resource_conditions": [
    {
      "resource_uri": "issue://issue-tracker/issues/1001",
      "expected_version": "17",
      "enforcement": "native"
    }
  ],
  "preview": {
    "fidelity": "estimate",
    "summary": "Change the owner of an issue: PATCH /issues/{args.issue_id} with fields [owner]. Remote behavior beyond the declared side effects is not simulated.",
    "effects": [
      {
        "side_effect_id": "owner_changed",
        "class": "remote_reversible",
        "description": "issue owner updated",
        "item_count": null
      }
    ]
  },
  "risk_tier": 1,
  "required_checks": [
    {
      "id": "owner_matches",
      "method": "read_back",
      "verifier_id": "http.readback",
      "target": "issue://issue-tracker/issues/{args.issue_id}",
      "predicate": {
        "op": "eq",
        "path": "/owner",
        "value": "bob"
      },
      "scope": "single",
      "freshness": {
        "max_age_seconds": 3600
      },
      "deadline_seconds": 10,
      "provenance": "user"
    }
  ],
  "policy_revision": "pol_8c1d0e5a7b3f4a2c9e6d1b0a5f7c3e21",
  "grant_revocation_revision": 0,
  "digest": "hmac-sha256:5f0c7e2a9b1d4c6e8f0a2b4c6d8e0f1a3b5c7d9e1f2a4b6c8d0e2f4a6b8c0d1e",
  "created_at": "2026-10-22T14:00:00.000Z",
  "expires_at": "2026-10-22T14:05:00.000Z",
  "status": "prepared",
  "status_reasons": [],
  "approval": {
    "required": false,
    "reason": null,
    "state": "not_required",
    "approval_id": null
  },
  "recovery_of": null,
  "extensions": {
    "vap.prepare": {
      "prior": {
        "owner": "alice",
        "version": 17
      },
      "prior_version": "17"
    }
  }
}
